{
  "kind": "upkeep_report",
  "report_version": "upkeep_report_v1",
  "ticket_reference": {
    "type": "github_issue",
    "url": "https://github.com/kuhlman-labs/fishhawk/issues/3726",
    "id": "kuhlman-labs/fishhawk#3726"
  },
  "generated_by": {
    "agent": "claude-code",
    "model": "claude-opus-5",
    "timestamp": "2026-10-03T09:00:00Z"
  },
  "summary": "Weekly upkeep scan over main at 74dade51: all three detectors ran. One flaky test seen failing then passing on the same tree in two runs, one Go toolchain pinned to two versions, and one deprecated stdlib package still in use. Three issues proposed.",
  "sources_scanned": ["flake", "toolchain_drift", "deprecation"],
  "findings": [
    {
      "id": "flake:TestWidgetSync",
      "source": "flake",
      "subject": "TestWidgetSync",
      "evidence": [
        {
          "kind": "run",
          "run_id": "6f1c2a3e-8b4d-4e5f-9a6b-7c8d9e0f1a2b",
          "stage_id": "0a1b2c3d-4e5f-4a6b-8c7d-9e0f1a2b3c4d",
          "detail": "verify failed on TestWidgetSync, then passed on the retry with no tree change"
        },
        {
          "kind": "run",
          "run_id": "9b8a7c6d-5e4f-4a3b-8c2d-1e0f9a8b7c6d",
          "stage_id": "1b2c3d4e-5f6a-4b7c-9d8e-0f1a2b3c4d5e",
          "detail": "same failure signature on an unrelated diff"
        }
      ],
      "proposed_issue": {
        "title": "Quarantine flaky test TestWidgetSync",
        "body": "TestWidgetSync failed and then passed on the same tree in two runs this week. Quarantine it and fix the ordering assumption it races on.",
        "type": "bug",
        "labels": ["area:backend", "type:bug"]
      }
    },
    {
      "id": "toolchain_drift:go",
      "source": "toolchain_drift",
      "subject": "go",
      "evidence": [
        {
          "kind": "file",
          "path": "go.work",
          "line": 1,
          "value": "go 1.25.0"
        },
        {
          "kind": "file",
          "path": "backend/Dockerfile",
          "line": 3,
          "value": "golang:1.24"
        }
      ],
      "proposed_issue": {
        "title": "Align the drifting Go toolchain pins",
        "body": "go.work pins Go 1.25.0 while backend/Dockerfile builds on golang:1.24. Pick one version and pin both.",
        "type": "chore",
        "labels": ["area:build"],
        "parent_epic": "#3726"
      }
    },
    {
      "id": "deprecation:io/ioutil",
      "source": "deprecation",
      "subject": "io/ioutil",
      "evidence": [
        {
          "kind": "file",
          "path": "backend/internal/legacy/load.go",
          "line": 12,
          "value": "ioutil.ReadFile",
          "detail": "io/ioutil is deprecated since Go 1.16; use os.ReadFile"
        }
      ],
      "proposed_issue": {
        "title": "Replace deprecated io/ioutil calls",
        "body": "backend/internal/legacy/load.go still calls ioutil.ReadFile. Replace it with os.ReadFile.",
        "type": "chore",
        "labels": []
      }
    }
  ]
}
